{
  "schema": "witnessdiff.evidence-bundle/v1",
  "session_id": "demo-dup-013",
  "source": "agent_platform_export",
  "completeness_claim": "partial_path",
  "actions": [
    {
      "index": 0,
      "tool_name": "crm_lookup",
      "action_id": "aaaaaaaaaaaaaaaaaaaaaaaaaaaaaaaaaaaaaaaaaaaaaaaaaaaaaaaaaaaaaaaa"
    }
  ]
}
