{
  "schema": "witnessdiff.evidence-bundle/v1",
  "session_id": "demo-extra-hop-005",
  "source": "agent_platform_export",
  "completeness_claim": "unknown",
  "declared_count": 3,
  "actions": [
    {
      "index": 0,
      "tool_name": "crm_lookup",
      "action_id": "aaaaaaaaaaaaaaaaaaaaaaaaaaaaaaaaaaaaaaaaaaaaaaaaaaaaaaaaaaaaaaaa"
    },
    {
      "index": 1,
      "tool_name": "order_lookup",
      "action_id": "bbbbbbbbbbbbbbbbbbbbbbbbbbbbbbbbbbbbbbbbbbbbbbbbbbbbbbbbbbbbbbbb"
    },
    {
      "index": 2,
      "tool_name": "policy_check",
      "action_id": "cccccccccccccccccccccccccccccccccccccccccccccccccccccccccccccccc"
    }
  ]
}
