{
  "schema": "witnessdiff.evidence-bundle/v1",
  "session_id": "demo-partial-007",
  "source": "agent_platform_export",
  "completeness_claim": "partial_path",
  "declared_count": 2,
  "actions": [
    {
      "index": 0,
      "tool_name": "crm_lookup",
      "action_id": "aaaaaaaaaaaaaaaaaaaaaaaaaaaaaaaaaaaaaaaaaaaaaaaaaaaaaaaaaaaaaaaa"
    },
    {
      "index": 1,
      "tool_name": "refund_request",
      "action_id": "dddddddddddddddddddddddddddddddddddddddddddddddddddddddddddddddd"
    }
  ]
}
