{
  "schema": "witnessdiff.evidence-bundle/v1",
  "session_id": "demo-digest-008",
  "source": "agent_platform_export",
  "completeness_claim": "complete_path",
  "declared_count": 2,
  "actions": [
    {
      "index": 0,
      "tool_name": "crm_lookup",
      "action_id": "aaaaaaaaaaaaaaaaaaaaaaaaaaaaaaaaaaaaaaaaaaaaaaaaaaaaaaaaaaaaaaaa",
      "arguments_digest": "1111111111111111111111111111111111111111111111111111111111111111"
    },
    {
      "index": 1,
      "tool_name": "order_lookup",
      "action_id": "bbbbbbbbbbbbbbbbbbbbbbbbbbbbbbbbbbbbbbbbbbbbbbbbbbbbbbbbbbbbbbbb",
      "arguments_digest": "9999999999999999999999999999999999999999999999999999999999999999"
    }
  ]
}
