{
  "schema": "witnessdiff.evidence-bundle/v1",
  "session_id": "wrong-session",
  "source": "agent_platform_export",
  "exported_at": "2026-03-24T18:22:00Z",
  "completeness_claim": "complete_path",
  "declared_count": 3,
  "actions": [
    {
      "index": 0,
      "tool_name": "crm_lookup",
      "action_id": "aaaaaaaaaaaaaaaaaaaaaaaaaaaaaaaaaaaaaaaaaaaaaaaaaaaaaaaaaaaaaaaa"
    },
    {
      "index": 1,
      "tool_name": "order_lookup",
      "action_id": "bbbbbbbbbbbbbbbbbbbbbbbbbbbbbbbbbbbbbbbbbbbbbbbbbbbbbbbbbbbbbbbb"
    },
    {
      "index": 2,
      "tool_name": "refund_request",
      "action_id": "dddddddddddddddddddddddddddddddddddddddddddddddddddddddddddddddd"
    }
  ]
}
